{
  "ruling_id": "ruling.convergent-mutation-errata-2025-11-04",
  "kind": "errata",
  "title": "Convergent Mutation (errata)",
  "card_name": "Convergent Mutation",
  "card_id": "ogn-108-298",
  "old_text": null,
  "new_text": "Choose a friendly unit. This turn, increase its Might to the Might of another friendly unit.",
  "explanation": "Added 'this turn'",
  "effective_date": "2025-11-04",
  "source_doc": "Origins Card Errata",
  "source": {
    "source_type": "official",
    "source_name": "Riftbound Origins Card Errata",
    "source_url": "https://riftbound.leagueoflegends.com/en-us/news/rules-and-releases/riftbound-origins-card-errata/",
    "source_date": "2025-11-04",
    "retrieved_at": "2026-04-27",
    "trust_tier": "official",
    "notes": "Promoted from reviewed legacy ruling row; live-page quote verification still pending."
  },
  "verification": {
    "status": "live_webfetch_text_verified",
    "verified_at": "2026-04-28",
    "method": "official_page_webfetch_review",
    "notes": "Official Riftbound page was fetched live with WebFetch on 2026-04-28 and the promoted errata/rules-change text was checked against the current page. Treat as official-source text verified; use the source URL for publication citations.",
    "live_matches": []
  },
  "legacy": {
    "source_file": "data/rulings/convergent-mutation--errata--5.json",
    "legacy_id": "ruling.convergent-mutation--errata--5",
    "legacy_record_id": 5,
    "legacy_status": "reviewed",
    "legacy_trust_level": "derived_verified"
  }
}
